{
  "schema_version": 1,
  "id": "allin1.colored_smokes",
  "name": "ALLIN1 Colored Smoke Grenades",
  "version": "1.0.0",
  "summary": "Seven independent M18-style smoke weapons showing a complete Enhanced Story Mode integration: metadata, ammo, animation, labels, HUD aliases, GBAY, runtime behavior, transactional archive writes, and save-bound persistence.",
  "editions": ["enhanced"],
  "nodes": [
    {
      "id": "smoke.weapons",
      "kind": "weapon",
      "label": "Seven custom weapon records",
      "description": "Cloned from WEAPON_SMOKEGRENADE, then assigned independent hashes, wheel slots, ammo pools, labels, and stat keys.",
      "source": "sdk/examples/colored_smokes/sources/SmokeRpfIntegration.cs",
      "fields": {
        "Name": ["WEAPON_ALLIN1_SMOKE_WHITE", "WEAPON_ALLIN1_SMOKE_RED", "WEAPON_ALLIN1_SMOKE_ORANGE", "WEAPON_ALLIN1_SMOKE_YELLOW", "WEAPON_ALLIN1_SMOKE_GREEN", "WEAPON_ALLIN1_SMOKE_BLUE", "WEAPON_ALLIN1_SMOKE_PURPLE"],
        "Slot": ["SLOT_ALLIN1_SMOKE_WHITE", "SLOT_ALLIN1_SMOKE_RED", "SLOT_ALLIN1_SMOKE_ORANGE", "SLOT_ALLIN1_SMOKE_YELLOW", "SLOT_ALLIN1_SMOKE_GREEN", "SLOT_ALLIN1_SMOKE_BLUE", "SLOT_ALLIN1_SMOKE_PURPLE"],
        "AmmoInfo": ["AMMO_ALLIN1_SMOKE_WHITE", "AMMO_ALLIN1_SMOKE_RED", "AMMO_ALLIN1_SMOKE_ORANGE", "AMMO_ALLIN1_SMOKE_YELLOW", "AMMO_ALLIN1_SMOKE_GREEN", "AMMO_ALLIN1_SMOKE_BLUE", "AMMO_ALLIN1_SMOKE_PURPLE"],
        "Model": "w_ex_grenadesmoke",
        "HumanNameHash": ["WT_A1SMWHI", "WT_A1SMRED", "WT_A1SMORA", "WT_A1SMYEL", "WT_A1SMGRE", "WT_A1SMBLU", "WT_A1SMPUR"],
        "StatName": ["A1SMWHITE", "A1SMRED", "A1SMORANGE", "A1SMYELLOW", "A1SMGREEN", "A1SMBLUE", "A1SMPURPLE"]
      }
    },
    {
      "id": "smoke.ammo",
      "kind": "ammo",
      "label": "Independent five-round ammo pools",
      "description": "Each color is a native inventory type capped at five. Native smoke deployment is disabled so the runtime layer owns color and timing.",
      "source": "sdk/examples/colored_smokes/sources/SmokeRpfIntegration.cs",
      "fields": {
        "Name": ["AMMO_ALLIN1_SMOKE_WHITE", "AMMO_ALLIN1_SMOKE_RED", "AMMO_ALLIN1_SMOKE_ORANGE", "AMMO_ALLIN1_SMOKE_YELLOW", "AMMO_ALLIN1_SMOKE_GREEN", "AMMO_ALLIN1_SMOKE_BLUE", "AMMO_ALLIN1_SMOKE_PURPLE"],
        "Model": "w_ex_grenadesmoke",
        "AmmoMax": 5,
        "AmmoMax50": 5,
        "Explosion": "",
        "TrailFx": "",
        "PrimedFx": ""
      }
    },
    {
      "id": "smoke.animations",
      "kind": "animation",
      "label": "Throwable animation mappings",
      "description": "Every custom hash needs the stock smoke mapping in all six animation sets or equipping can produce a T-pose.",
      "source": "sdk/examples/colored_smokes/sources/SmokeRpfIntegration.cs",
      "fields": {
        "WeaponNames": ["WEAPON_ALLIN1_SMOKE_WHITE", "WEAPON_ALLIN1_SMOKE_RED", "WEAPON_ALLIN1_SMOKE_ORANGE", "WEAPON_ALLIN1_SMOKE_YELLOW", "WEAPON_ALLIN1_SMOKE_GREEN", "WEAPON_ALLIN1_SMOKE_BLUE", "WEAPON_ALLIN1_SMOKE_PURPLE"],
        "Template": "WEAPON_SMOKEGRENADE",
        "Sets": ["Default", "FirstPerson", "FirstPersonAiming", "FirstPersonRNG", "Female", "GangFemale"]
      }
    },
    {
      "id": "smoke.labels",
      "kind": "text_label",
      "label": "Native weapon-wheel labels",
      "description": "The seven GXT keys are merged into the current build's global.gxt2 rather than painted over the HUD by script.",
      "source": "sdk/examples/colored_smokes/sources/SmokeRpfIntegration.cs",
      "fields": {
        "Labels": {"WT_A1SMWHI": "White Smoke", "WT_A1SMRED": "Red Smoke", "WT_A1SMORA": "Orange Smoke", "WT_A1SMYEL": "Yellow Smoke", "WT_A1SMGRE": "Green Smoke", "WT_A1SMBLU": "Blue Smoke", "WT_A1SMPUR": "Purple Smoke"},
        "Archive": "x64/patch/data/lang/american_rel.rpf",
        "Entry": "global.gxt2"
      }
    },
    {
      "id": "smoke.hud",
      "kind": "hud_alias",
      "label": "BZ Gas weapon-wheel artwork aliases",
      "description": "Scaleform chooses weapon artwork by signed weapon hash. Both BZ Gas HUD timelines receive frame-label aliases for each custom hash; StatName does not control this icon.",
      "source": "sdk/examples/colored_smokes/sources/SmokeRpfIntegration.cs",
      "fields": {
        "SourceWeaponNames": ["WEAPON_ALLIN1_SMOKE_WHITE", "WEAPON_ALLIN1_SMOKE_RED", "WEAPON_ALLIN1_SMOKE_ORANGE", "WEAPON_ALLIN1_SMOKE_YELLOW", "WEAPON_ALLIN1_SMOKE_GREEN", "WEAPON_ALLIN1_SMOKE_BLUE", "WEAPON_ALLIN1_SMOKE_PURPLE"],
        "FrameTemplate": "INT-1600701090",
        "Archive": "x64/data/cdimages/scaleform_generic.rpf",
        "Entry": "hud.gfx",
        "ExpectedFrames": {
          "WEAPON_ALLIN1_SMOKE_WHITE": "INT-121305898",
          "WEAPON_ALLIN1_SMOKE_RED": "INT1261938036",
          "WEAPON_ALLIN1_SMOKE_ORANGE": "INT-501266210",
          "WEAPON_ALLIN1_SMOKE_YELLOW": "INT-83052710",
          "WEAPON_ALLIN1_SMOKE_GREEN": "INT-1204245632",
          "WEAPON_ALLIN1_SMOKE_BLUE": "INT-1546479652",
          "WEAPON_ALLIN1_SMOKE_PURPLE": "INT-768140124"
        }
      }
    },
    {
      "id": "smoke.runtime",
      "kind": "runtime",
      "label": "Grounded colored-plume controller",
      "description": "Tracks the matching custom projectile, waits for a stable collision, removes the noisy rolling canister, then emits the selected color at the settled position.",
      "source": "sdk/examples/colored_smokes/sources/EnhancedSmokeController.cs",
      "fields": {
        "WeaponNames": ["WEAPON_ALLIN1_SMOKE_WHITE", "WEAPON_ALLIN1_SMOKE_RED", "WEAPON_ALLIN1_SMOKE_ORANGE", "WEAPON_ALLIN1_SMOKE_YELLOW", "WEAPON_ALLIN1_SMOKE_GREEN", "WEAPON_ALLIN1_SMOKE_BLUE", "WEAPON_ALLIN1_SMOKE_PURPLE"],
        "Controller": "EnhancedSmokeController",
        "Persistence": "Stage inventory changes in memory; commit only with the Story Mode save.",
        "ColoredBloomScale": 2.9,
        "ColoredSteadyScale": 2.2,
        "WhiteBloomScale": 1.45,
        "WhiteSteadyScale": 1.1,
        "StableGroundMilliseconds": 300
      }
    },
    {
      "id": "smoke.gbay",
      "kind": "storefront",
      "label": "GBAY product and persistence integration",
      "description": "Seven separately purchasable five-packs with independent stock and native ammo counts.",
      "source": "sdk/examples/colored_smokes/sources/SmokeGrenadeCatalog.cs",
      "fields": {
        "WeaponNames": ["WEAPON_ALLIN1_SMOKE_WHITE", "WEAPON_ALLIN1_SMOKE_RED", "WEAPON_ALLIN1_SMOKE_ORANGE", "WEAPON_ALLIN1_SMOKE_YELLOW", "WEAPON_ALLIN1_SMOKE_GREEN", "WEAPON_ALLIN1_SMOKE_BLUE", "WEAPON_ALLIN1_SMOKE_PURPLE"],
        "Catalog": "GBAY > Weapons > Throwables",
        "Persistence": "Purchases and consumption become permanent only when the character saves the game.",
        "PackSize": 5
      }
    },
    {
      "id": "archive.weapons",
      "kind": "archive",
      "label": "Base weapon metadata merge",
      "source": "sdk/examples/colored_smokes/sources/SmokeRpfIntegration.cs",
      "fields": {"Path": "mods/update/update.rpf", "Entry": "common/data/ai/weapons.meta", "MergeStrategy": "Clone current-build WEAPON_SMOKEGRENADE records and append validated definitions.", "Backup": "Exact entry backup plus pre-merge update.rpf snapshot."}
    },
    {
      "id": "archive.animations",
      "kind": "archive",
      "label": "Base animation metadata merge",
      "source": "sdk/examples/colored_smokes/sources/SmokeRpfIntegration.cs",
      "fields": {"Path": "mods/update/update.rpf", "Entry": "common/data/ai/weaponanimations.meta", "MergeStrategy": "Clone the stock mapping in every compatible set and change only its key.", "Backup": "Exact entry backup plus pre-merge update.rpf snapshot."}
    },
    {
      "id": "archive.language",
      "kind": "archive",
      "label": "Nested language archive merge",
      "source": "sdk/examples/colored_smokes/sources/SmokeRpfIntegration.cs",
      "fields": {"Path": "mods/update/update.rpf", "Entry": "x64/patch/data/lang/american_rel.rpf/global.gxt2", "MergeStrategy": "Open nested archive under its exact filename and append seven hashed GXT entries.", "Backup": "Exact american_rel.rpf backup plus pre-merge update.rpf snapshot."}
    },
    {
      "id": "archive.hud",
      "kind": "archive",
      "label": "Nested Scaleform HUD merge",
      "source": "sdk/examples/colored_smokes/sources/SmokeRpfIntegration.cs",
      "fields": {"Path": "mods/update/update.rpf", "Entry": "x64/data/cdimages/scaleform_generic.rpf/hud.gfx", "MergeStrategy": "Add only the seven FrameLabel tags beside each BZ Gas frame and prove stripping them reproduces the original bytes.", "Backup": "Exact scaleform_generic.rpf backup plus pre-merge update.rpf snapshot."}
    },
    {
      "id": "package.safety",
      "kind": "package",
      "label": "Enhanced-safe base merge",
      "source": "sdk/examples/colored_smokes/sources/enhanced-smoke-rpf-port.md",
      "fields": {"Registration": "No add-on dlclist entry; uses verified base-archive merges.", "Edition": "Enhanced", "Safety": "GTA must be closed; write exact backups first; validate merged bytes; rollback the full snapshot on failure."}
    }
  ],
  "references": [
    {"id": "weapon-ammo", "source": "smoke.weapons", "source_field": "AmmoInfo", "target": "smoke.ammo", "target_field": "Name", "relationship": "uses_ammo", "description": "Every weapon points at its same-color independent ammo pool."},
    {"id": "weapon-animation", "source": "smoke.weapons", "source_field": "Name", "target": "smoke.animations", "target_field": "WeaponNames", "relationship": "uses_animation", "description": "Every weapon hash is present in all required throwable animation sets."},
    {"id": "weapon-label", "source": "smoke.weapons", "source_field": "HumanNameHash", "target": "smoke.labels", "target_field": "Labels", "relationship": "uses_label", "description": "Every HumanNameHash resolves to a native GXT string."},